title,description,letterboxd_url
The Social Network,"A cold, driven climb fueled by ambition, insecurity, and the quiet cost of success. It feels sharp and fast — conversations moving like battles, decisions made with precision but little warmth. There’s a constant undercurrent of isolation, like winning is pulling you further away from everyone else. You leave it impressed, uneasy, and reflecting on what it really takes — and what it quietly costs — to build something that big.",https://letterboxd.com/film/the-social-network/
Project Hail Mary,"A tense but hopeful fight against impossible odds, driven by curiosity, problem-solving, and an unexpected sense of connection. It feels isolating at first — quiet, uncertain, and disorienting — but gradually shifts into something warmer and more collaborative, where small breakthroughs feel huge and trust becomes everything. There’s a steady momentum of figuring things out, piece by piece. You leave it uplifted, impressed, and quietly reassured about ingenuity and unlikely friendship.",https://letterboxd.com/film/project-hail-mary/
La La Land,"A dreamy, bittersweet chase between ambition and love, where everything feels possible — until it isn’t. It moves with a light, almost magical energy, but underneath is a quiet tension between holding on and letting go. There’s warmth, longing, and the slow realization that timing can matter more than love itself. You leave it nostalgic, inspired, and a little heartbroken in a way that lingers.",https://letterboxd.com/film/la-la-land/
The Fast and the Furious,"A high-adrenaline rush of speed, loyalty, and living fast without looking too far ahead. It feels slick and kinetic — late nights, engines roaring, and a constant pull between belonging and breaking the rules. There’s a sense of danger, but also a tight-knit loyalty underneath it all. You leave it amped up, energized, and craving that feeling of freedom and momentum.",https://letterboxd.com/film/the-fast-and-the-furious-2001/
Dinner in America,"A chaotic, offbeat rush of rebellion and misfit connection that feels loud, messy, and strangely sincere. It’s abrasive on the surface — raw, impulsive, a little unhinged — but underneath is something oddly tender, like two outsiders finding their own language in a world that doesn’t get them. You leave it energized, amused, and unexpectedly warm toward its rough edges.",https://letterboxd.com/film/dinner-in-america/
Final Destination Bloodlines,"A constant sense of dread where death feels inevitable, just waiting for the right moment to strike. It’s tense and unsettling, building anxiety in the smallest details — like everything around you could suddenly turn against you. There’s a grim curiosity to it, but no real safety, no escape from what’s coming. You leave it on edge, hyper-aware, and a little paranoid about how fragile everything actually is.",https://letterboxd.com/film/final-destination-bloodlines/
Nomadland,"A quiet, open-ended drifting through loss, freedom, and what remains when everything familiar is gone. It feels still and expansive — lonely at times, but never empty — like learning how to exist without needing to be anchored anywhere. There’s a quiet resilience in it, a softness toward life as it is. You leave it calm, reflective, and a little untethered in a way that’s strangely peaceful.",https://letterboxd.com/film/nomadland/
Fight Club,"A restless, suffocating spiral of identity and suppressed rage finally breaking loose. It feels raw and chaotic — like something inside you that’s been quiet for too long suddenly demanding to be felt. There’s a dark thrill to it, but also a sense that things are slipping further and further out of control. You leave it wired, unsettled, and questioning what’s real — and what parts of yourself you’ve been ignoring.",https://letterboxd.com/film/fight-club/
Drive,"A quiet, neon-lit descent into loneliness, restraint, and sudden bursts of violence. It feels minimal and controlled — long stretches of stillness with an undercurrent of tension, like something dangerous is always just beneath the surface. There’s a detached calm to it, but also a growing sense that it can’t hold forever. You leave it cool, unsettled, and lingering in that late-night, almost dreamlike haze.",https://letterboxd.com/film/drive-2011/
Once Upon a Time… in Hollywood,"A hazy, sun-soaked drift through a fading era, where nostalgia and uncertainty quietly coexist. It feels loose and unhurried — moments stretching out, conversations wandering, like you’re just living inside the world rather than chasing a story. Beneath it all is a quiet tension about change, relevance, and time slipping forward. You leave it relaxed, nostalgic, and reflecting on what it means to hold onto something as it slowly disappears.",https://letterboxd.com/film/once-upon-a-time-in-hollywood/
GoodFellas,"A fast, intoxicating rise into a world that feels electric, seductive, and untouchable. It moves with momentum and confidence — everything sharp, stylish, and alive — until the cracks start to show and the energy turns frantic and paranoid. The thrill never fully disappears, but it becomes something more unstable. You leave it exhilarated, overwhelmed, and aware of how quickly that kind of life can spiral.",https://letterboxd.com/film/goodfellas/